Dialogue,Emotions
(answering phone) Hello.,"Confidence, Neutral, Anticipation"
"(on phone) Hey, it’s me. I know you can’t stand to be in thesame room as me, so I just thought I’d try and apologize over the phone. All I…(Joey hangs up the phone in disgust.)","Anger, Disgust, Frustration"
(answering phone) Hello.,"Confidence, Neutral, Anticipation"
"Look I never should have kissed your girlfriend, but I’m…(Joey hangs up the phone again.)","Anger, Frustration"
(answering phone) Stop callin’!!,"Anger, Disgust, Frustration"
"(on phone) Hey! Hey! Hey! This is 92.3, WXRK, K-Rock for our $1,000 dailychallenge.","Confidence, Excitement, Anticipation"
All right!,"Happiness, Excitement, Optimism"
"What is the name of your roommate who is very, very sorry and would doanything… (Joey realizes it’s Chandler and hangs up the phone in anger.)","Anger, Surprise, Frustration"
"(entering) Aww, turkey! Aww, giving thanks! Aww!","Happiness, Surprise, Excitement"
"Look everyone, it’s the spirit of Thanksgiving!","Happiness, Love, Excitement"
So are things with you and Joey any better?,"Neutral, Anticipation, Frustration"
"They couldn’t be worse. I spent eight hours calling him lastnight, just trying to get him to talk to me.","Sadness, Frustration, Longing"
"Oh wow, eight hours? So you could probably really use one of thoseplug-in telephone headsets huh?","Surprise, Anticipation, Optimism"
Should we,Neutral
You shouldn’t.,"Neutral, Disgust, Frustration"
"Speaking of Christmas, umm since Monica and I are starting a newbusiness and have like no money, umm, this year maybe we could do secret Santa, and thenwe each only buy one gift. And-and there’s the added mystery of who gets who.","Excitement, Anticipation, Optimism"
Who gets whom. (They all look at him.) I don’t know why I do that.,"Surprise, Confusion, Frustration"
"Well, I’m gonna take a nap, turkey makes me sleepy.","Contentment, Neutral"
We haven’t eaten yet!,"Anticipation, Frustration"
"I know, but all that work you’re doing to get it ready, Ijust… (goes into her bedroom.)","Neutral, Sadness, Frustration"
"Hey, by any chance did either of pick uh Rachel for your secret Santa,‘cause I wanna trade for her.","Excitement, Anticipation, Frustration"
I picked her! Oh thank God you want her! Ooh!,"Happiness, Surprise, Excitement"
Wow! Why do you want to get rid of her so badly?,"Surprise, Confusion, Frustration"
"Because she exchanges every gift she ever gets, it’s likeimpossible to get her something she likes. Come on, let’s trade!","Confusion, Frustration, Optimism"
"Oh that’s not true! That’s not true! I got her that backpackand she loved it! I remember how much she was crying the day when that big dog ran offwith it… (notices the look on Monica and Phoebe’s faces.) Oh, there was no bigdog. All right this sucks! I already got her this briefcase, and I had R.G. put onit… (Phoebe looks confused.) Her initials…","Nostalgia, Confusion, Frustration"
Ohh.,"Neutral, Surprise, Confusion"
"Well, maybe you could give to somebody else. Ooh, like Ross Geller.","Contentment, Excitement, Anticipation"
"Op, y'know what though, it’s kind’ve a girlie briefcase.","Neutral, Confusion, Frustration"
Who cares? He works in a museum!,Neutral
"Hey, what time is it? The big game is about to start!","Excitement, Anticipation, Optimism"
"You don’t have to do that, Ross and Joey aren’t here, you canwatch the parade if you want.","Contentment, Neutral, Optimism"
Thanks.,"Happiness, Contentment, Neutral"
What is wrong with this freezer?! (She jabs her arm into the freezer anda piece of ice flies into her eye.) Ow! Ow!!,"Surprise, Frustration"
"God, what happened?!","Fear, Surprise, Confusion"
"Oh my God, ice just got in my eye!",Surprise
(standing in her doorway) People are trying to sleep in here!,"Anger, Frustration"
"Monica got ice in her eye, and it hurts.",Sadness
"Open it up, let me see.","Confidence, Excitement, Anticipation"
"Oh, y’know what, I can’t, it really kills.","Sadness, Disgust, Frustration"
Well maybe you should put some ice on it.,Neutral
"Ooh, God it looks bad.","Sadness, Fear, Disgust"
"Honey, maybe we should take you to a doctor.",Unknown
"No, my eye doctor is Richard! I can’t go to him when I don’thave a boyfriend!","Confusion, Frustration, Longing"
He’s really picky about his patients.,"Confidence, Neutral, Frustration"
"Honey, you’ve got to go. What’s his office number?","Confidence, Frustration"
Like I remember his office number! (Pause) Speed dial 7.,"Confidence, Excitement, Nostalgia"
"(on phone) Hi! Yeah, I’m calling on behalf of Monica Geller’seye, and is um, is Richard Burke in today. (Listens) (to Monica) He’s out of town,but does she want to see the on-call doctor?","Neutral, Confusion, Frustration"
Yes!!,"Happiness, Excitement, Optimism"
Yes! She’s very excited about that.,"Happiness, Excitement, Optimism"
"This is so cool, ‘til Monica gets back, it’s like I’mhead chef and I get to make all the decisions. (She looks at the remaining butter, andthen decides to add it to the dish.)","Happiness, Confidence, Excitement"
"Hey-hey, I thought she told you to follow the recipe exactly!","Surprise, Frustration"
"Okay, get out of my kitchen!","Confidence, Anger, Frustration"
"(entering) All right! Okay! I think I am making some progress withJoey, when I went into the apartment he went straight into his bedroom but he only slammedthe door once! (Ross is pleased.) I mean yeah, he gave me the finger while doing it.","Happiness, Contentment, Excitement"
All right I… I gotta call my mom and ask her a left handed cookingquestion.,"Confidence, Excitement, Anticipation"
"So listen ah, I picked Monica for secret Santa, but I’m alreadygetting her something for Chanukah, I was wondering if you wanna switch.","Excitement, Anticipation, Frustration"
"Oh y’know what, I was already trying to trade for ah, well, you.","Neutral, Confusion, Frustration"
"Really?! Wow! That’s-that’s so nice, what are you gonna get me?","Surprise, Excitement, Anticipation"
"I don’t know R.G., I was thinking something girlie for youroffice.","Neutral, Confusion, Frustration"
"Yeah, well maybe Phoebe will switch with me.","Neutral, Frustration, Optimism"
"Oh no-no-no, you don’t want to do that, then you’re gonnaget stuck with Rachel and she exchanges every gift she ever gets.",Frustration
"Oh, that’s not true! I’ve got her lots of stuff she never tookback.","Neutral, Confusion, Frustration"
Like?,"Neutral, Confusion, Frustration"
"Like uh, that gold necklace I got her last year.","Contentment, Love, Nostalgia"
When was the last time you saw her wear it?,"Neutral, Confusion"
"Well, she wore it all Christmas day, and then uh…","Neutral, Nostalgia, Confusion"
Big dog?,"Happiness, Surprise, Excitement"
(entering) Hey!,"Happiness, Surprise, Excitement"
Hey!,"Happiness, Surprise, Excitement"
What are you doing?,"Neutral, Confusion, Frustration"
I’m sending back all this stuff that Chandler bought out of guilt.,"Sadness, Frustration"
Everything? Even the TV?,"Surprise, Disgust, Frustration"
No! I’m putting that in my room.,"Confidence, Frustration"
"Listen, Joey, I know what he did was wrong but don’t you think youcould at least hear the guy out?","Confusion, Frustration, Optimism"
"Back when you and Rachel were together, if Chandler had kissed her, wouldyou hear him out?","Nostalgia, Confusion, Frustration"
"That’s a good point. So uh, how long are you gonna punish him?","Neutral, Confusion, Frustration"
Five years.,"Neutral, Nostalgia, Optimism"
You’ve sentenced him?!,"Anger, Surprise, Confusion"
Hey! Don’t do the crime if you can’t do the time.,"Confidence, Frustration, Optimism"
"Joey, the guy’s your best friend.","Happiness, Contentment, Confidence"
"No,","Neutral, Confusion, Frustration"
"Oh, who? Me?","Confidence, Surprise, Confusion"
Yeah!,"Happiness, Excitement, Optimism"
Wow! I’m honored! And y’know what I’m gonna do as my firstact as your best friend?,"Happiness, Excitement, Anticipation"
What?,"Surprise, Confusion, Frustration"
I’m gonna get you to talk to Chandler.,"Confidence, Excitement, Anticipation"
All right. But if you weren’t my best friend.,"Neutral, Sadness, Frustration"
"Oh my God, is it really that bad?","Fear, Surprise"
"I walk into a room and he won’t even talk to me, he just mumblessomething in Italian. And I","Sadness, Confusion, Frustration"
"(entering) Hey Gunther, have you uh, have you seen Chandler?","Neutral, Anticipation, Confusion"
"I thought you were Chandler. But umm, one of who is overthere.","Surprise, Confusion, Frustration"
Oh.,Neutral
Hey Joe.,Neutral
(Something in Italian.) (Storms out.),"Anger, Confusion, Frustration"
"I’ll be right with you. Okay? (to the nurse) Thanks, Wendy.",Neutral
Oh my God! How cute is the on-call doctor?,"Happiness, Surprise, Excitement"
"Ooh, so cute, that I’m thinking about jamming this pen in my eye.","Fear, Surprise, Disgust"
Dr. Burke will see you know.,"Confidence, Neutral, Anticipation"
"Oh no-no-no, not Dr. Burke. Dr. Burke is out of town. The-the on-calldoctor will see me now.","Neutral, Surprise, Frustration"
"Dr. Richard Burke is out of town. Dr. Timothy Burke, his son, will seeyou now.","Confidence, Neutral, Anticipation"
Ready?,"Excitement, Anticipation, Optimism"
Hey! I’m sorry! That—(sees that Joey is about to leave)where are you going?,"Surprise, Confusion"
My folks.,"Contentment, Love, Nostalgia"
"Oh, uh, when-when are you coming back?","Anticipation, Nostalgia, Longing"
I don’t know. I might stay there for a few days while I look for anapartment.,"Neutral, Anticipation, Confusion"
What?!,"Surprise, Disgust, Confusion"
"Yeah, y’know at first I thought we could talk about this y’know,work it out, but uh, seeing you two together I don’t think I…","Sadness, Confusion, Frustration"
"Hey, look, what do you want me to say? Do you want me to say thatI’ll stop seeing her?","Anger, Confusion, Frustration"
"Look, it’s not about her. Okay? But seeing you two together justreminds me of what you did. And I don’t want to live with some one who doesn’tknow what it is to be a friend. So, I’ll see ya. (He starts to leave, but Chandlergrabs his bag and stops him.)","Sadness, Anger, Frustration"
"Hey, look, I know what it is to be a friend, I just-I just screwed up!","Sadness, Frustration"
Yeah! You did! And that’s why I’m leaving.,"Sadness, Anger, Frustration"
"All right look, if you’re not gonna stay for me, then at leaststay for them! Okay, they have had a","Sadness, Anger, Frustration"
"When that guy was robbing us, and I was locked in the entertainment unitfor like six hours, you know what I was doing in there all that time? I was thinking abouthow I let you down!","Sadness, Fear, Frustration"
What?,"Surprise, Confusion, Frustration"
"Yeah! But if would’ve know what kind of friend you were gonna turnout to be, I wouldn’t have worried about it so much! See you around!","Confidence, Sadness, Frustration"
"All right, wait! Come on! Just wait one second! There has to besomething that I can do! Something! If we still had that entertainment unit I would get init for six hours and think about how I let you down. (Joey looks intrigued) What?","Frustration, Longing, Optimism"
We’ve got a box. (Motions to a large wooden box next to him.),"Confidence, Neutral, Excitement"
"Last time I saw you, it was the morning I left for college. And you werejust standing outside","Sadness, Nostalgia, Longing"
I was probably waiting for it to open.,"Neutral, Anticipation, Frustration"
"I gotta tell you, you look great now.","Happiness, Confidence, Excitement"
You look great too.,"Happiness, Contentment, Confidence"
You’re an excellent patient!,"Happiness, Contentment, Confidence"
So how does it look?,"Confidence, Excitement, Anticipation"
"Well, you’ve got a little scratch on your cornea, your gonna have towear a patch for a couple of days.","Confidence, Neutral, Frustration"
Like a pirate?!,"Surprise, Excitement"
If that helps you.,"Contentment, Neutral, Frustration"
"Umm, so how long have you been working with your dad? (He looks at her)Come on, one of us had to mention him.","Happiness, Contentment, Excitement"
I moved back here a couple of months ago.,"Excitement, Nostalgia, Optimism"
Oh. Big family dinner tonight?,"Happiness, Excitement, Anticipation"
Uh. (He holds up a brown lunch bag.),"Neutral, Surprise, Excitement"
No way!,"Surprise, Excitement, Optimism"
I was gonna have Thanksgiving at my girlfriend’s.,"Happiness, Love, Excitement"
(disappointed) Oh.,"Neutral, Sadness"
But we broke up.,"Sadness, Disgust, Frustration"
(happy) Oh.,"Happiness, Contentment, Neutral"
She-she wasn’t ready for a serious commitment.,"Neutral, Confusion, Frustration"
"(sympathetic) Oh. (in a pirate’s voice) So you made her walk theplank? Aye, matie?",Surprise
You’re not wearing the patch yet.,"Neutral, Confusion, Frustration"
I know.,"Contentment, Confidence, Neutral"
He’s coming here for Thanksgiving!,"Happiness, Excitement, Anticipation"
"I know, it’s sick.","Sadness, Disgust, Frustration"
Why is it sick?,"Disgust, Confusion, Frustration"
Because it’s Richard’s son! It’s like inviting Greektragedy over for dinner!,"Anger, Surprise, Disgust"
"Hey, come on, Phoebe, you understand don’t you?","Confidence, Neutral, Frustration"
"Yeah, I can see where I’d be your best shot but, no. I’msorry, but I think it’s twisted.","Neutral, Sadness, Frustration"
Yeah.,"Contentment, Confidence, Neutral"
(coming out of the bathroom) What’s twisted?,"Neutral, Confusion"
Me going out with Richard’s son.,"Excitement, Anticipation, Confusion"
Ewwwww!! Ew! Ew! Ew!,"Fear, Disgust, Frustration"
"(He is now in the box, in their living room.) Sounds like a really badidea to me.","Neutral, Confusion, Frustration"
Is he okay in there?,Unknown
He’s fine!,"Contentment, Confidence, Optimism"
"Hey, y'know, Mon, if things wrong out between you and Richard’s son,you’d be able to tell your kids, that you slept with their grandfather.","Surprise, Disgust"
"Fine! Judge all you want to but, (points to Ross) married a lesbian,(points to Rachel) left a man at the altar, (points to Phoebe) fell in love with a gay icedancer, (points to Joey) threw a girl’s wooden leg in a fire, (points to Chandler)livin’ in a box!! (goes to her room)","Anger, Disgust, Frustration"
"So now, what exactly is the point of the box?","Confusion, Frustration"
Chandler?,"Neutral, Surprise, Confusion"
"The meaning of the box is three fold. One (holds a finger up throughthe air hole), it gives me the time to think about what I did. Two (holds up anotherfinger), it proves how much I care about my friendship with Joey. And three (holds up athird finger), it hurts!","Sadness, Confusion, Frustration"
"(to Rachel) Oh hey! Hey uh, you remember the necklace I gave you lastyear? Can I see it?","Happiness, Excitement, Nostalgia"
(worried) Why?,"Fear, Confusion"
I just wanna check something.,"Neutral, Anticipation, Confusion"
Okay. (She goes into her bedroom),"Contentment, Neutral, Confusion"
"(He puts his hand over the hole on the box.) (to Chandler) Now, we’llsee.","Confidence, Excitement, Anticipation"
Air hole! Air hole!! (Ross retracts his hand quickly.),"Fear, Surprise, Excitement"
(coming out of her bedroom with a necklace) Here it is! I love it. Iwear it all the time.,"Happiness, Love, Excitement"
"(grabbing the necklace) The necklace I got you was gold, this one issilver.","Happiness, Contentment, Surprise"
"Huh, well maybe it uh, it changed.",Confusion
Oh my God! You actually exchanged it!,"Happiness, Surprise, Excitement"
Well isn’t it better that I exchanged it for something that I enjoyand that I can get a lot of use out of?,"Happiness, Contentment, Optimism"
What did you get?,"Excitement, Anticipation, Optimism"
Credit.,Neutral
"(running in from her bedroom) I’ll get it! I’ll get it!I’ll get it! I’ll get it! I’ll get it! I’ll get it! I’ll get it!I’ll get it! I’ll get it! I’ll get it! I’ll get it! I’ll get it!I’ll get it! I’ll get it! (opens the door) Hi, Tim.","Happiness, Confidence, Excitement"
Hi. (gives her a bottle of wine),"Happiness, Contentment, Excitement"
"Thank you. Come meet my friends. This is uh, Phoebe.","Happiness, Confidence, Excitement"
"Hi, nice to meet you.","Happiness, Confidence, Excitement"
And Joey.,Neutral
Hey!,"Happiness, Surprise, Excitement"
"Hi, Joey.","Happiness, Contentment, Confidence"
"My brother, Ross.","Neutral, Surprise, Love"
Hey.,"Neutral, Anticipation, Confusion"
And Rachel. (Chandler clears his voice loudly) And that’s Chandler.,"Confidence, Surprise, Frustration"
How do ya do.,"Contentment, Neutral, Nostalgia"
What’s…,"Surprise, Anticipation, Confusion"
"Umm, well, he’s…","Neutral, Confusion, Frustration"
He’s doin’ some thinkin’!,"Confidence, Excitement, Anticipation"
What happened? What happened?!,"Fear, Surprise, Frustration"
You kissed my girlfriend!,"Sadness, Anger"
"Ooh, I like those sunglasses.","Happiness, Love, Excitement"
"Like ‘em, like ‘em? Or, I’d like to get store credit forthat amount like ‘em?","Anticipation, Confusion, Frustration"
"(Swears in Italian, it’s the same term used by Joey earlier andJoey nods his approval.)",Anger
"All right everybody, this turkey is ready!","Confidence, Excitement, Anticipation"
Where can I wash up?,"Neutral, Confusion, Frustration"
"Here, let me show you. Okay, the towels are hanging next to the sink,and umm, you can use the fancy soap.","Contentment, Confidence, Neutral"
Thank you.,"Happiness, Contentment"
Fancy soap? I thought we were savin’ that for the Pope!,"Surprise, Confusion"
See he’s nice. Right?,"Happiness, Contentment, Confidence"
"Yeah, but Monica, do you actually want to be in a relationship where youcan actually use the phrase, That’s not how your dad used to do it.""""","Nostalgia, Confusion, Frustration"
Wow! Everything looks great! Where should I sit?,"Happiness, Surprise, Excitement"
I saved you a seat. (Motions to the one next to her.),"Happiness, Contentment, Excitement"
(pouring the wine) Sick-sick-sick-sick.,"Neutral, Disgust, Frustration"
"Oh, I’ll get it. (goes over to the door.)","Confidence, Excitement, Anticipation"
Gotcha! (laughs),"Happiness, Surprise, Excitement"
That doesn’t sound like thinking to me!,"Disgust, Confusion, Frustration"
Sorry!,Neutral
Y’know I don’t think you should be talking at all in there! Ithink you’ve got to much thinking to do to be talking and making jokes!,"Anger, Disgust, Frustration"
"Okay, okay, you got it!","Happiness, Confidence"
"Ross, can you pass me the yams?","Contentment, Confidence, Neutral"
"Sure! Oh, and Joey’s got the mashed potatoes if you want to exchangethem.","Happiness, Excitement, Anticipation"
Would you stop?! What is the matter with you?!,"Anger, Confusion, Frustration"
"Oh-ho-ho, we’ve got company.","Confidence, Surprise, Excitement"
"There’s nothing the matter with me. See, I’m not completelydevoid of sentiment, see I have feelings.","Confidence, Disgust, Frustration"
"Okay, fine. (She gets up and walks into her bedroom)","Neutral, Disgust, Frustration"
"You can’t tell, but I’m trying to break the tension bymooning you guys!","Happiness, Excitement, Optimism"
"All right, look! If this is just a big joke to you, then forget about it,all right?! This means something to me! And if it doesn’t mean anything to you, thenyou should get out of there, otherwise you’re just an idiot in a box!","Anger, Confusion, Frustration"
"You’re right, and I’m sorry! This means a lot to me! I wantyou to be my friend again! I swear, I won’t say another word tonight.",Unknown
So are you gonna start taking this thing seriously?,"Anticipation, Confusion, Frustration"
Absolutely!,"Happiness, Confidence, Excitement"
That sounds like another word to me! Are you gonna take this seriously?(There’s no response from Chandler.) Okay.,"Neutral, Confusion, Frustration"
"Don’t say that I have no sentiment! (Starts to show Rosswhat’s in the box.) This is a movie stub from our first date! This is an eggshellfrom the first time you made me breakfast in bed! (Holds up a bone) This is from themuseum from the first time we… were together. Okay, maybe I exchange gifts sometimes,but I keep the things that matter!","Happiness, Love, Nostalgia"
"I don’t know what to say, I’m sorry. Though, you’re notsupposed to take these. (Points to the bone) It’s like a million years old, we, weactually, we had people looking for that.","Neutral, Confusion, Frustration"
"(putting off her coat) Ooh, this always happens. (Her coat gets stuck.)","Surprise, Disgust, Frustration"
"Here, let me help. (Does so.)","Happiness, Contentment, Confidence"
Thank you.,"Happiness, Contentment, Confidence"
You-you have a very beautiful… eye.,"Happiness, Surprise"
Y’know all my friends think this is weird.,"Surprise, Confusion, Frustration"
"Y’know I-I thought it was gonna be weird, I mean I almost called andcanceled, but it really isn’t.","Happiness, Surprise"
"I know! I mean it’s like me and your dad, that’s a totallyseparate thing.","Neutral, Confusion, Frustration"
"Oh, I totally agree.","Contentment, Confidence"
We’re just two people who find each other very attractive. Right?,"Love, Excitement, Optimism"
What?,"Surprise, Confusion, Frustration"
Nothing. Nothing.,"Neutral, Sadness, Frustration"
"No-no really, was-was that not okay?","Confusion, Frustration"
"No-no-no that was good, it was, that was uh, that was a goood kiss…","Happiness, Contentment, Excitement"
Oh my God! It didn’t remind you of…,"Fear, Surprise, Excitement"
(interrupting) Don’t say it!,"Surprise, Confusion, Frustration"
"No, but it did! Didn’t it?!","Surprise, Confusion, Frustration"
Yeah!,"Happiness, Excitement, Optimism"
Oh man!!,"Happiness, Surprise, Excitement"
I know!,"Happiness, Confidence, Excitement"
I’ll get it. (It’s Kathy.),"Confidence, Neutral, Anticipation"
(sees it’s Joey) Oh.,"Neutral, Surprise, Nostalgia"
Hey.,Neutral
"Hey. Listen, I want you to know how sorry I am…",Sadness
That’s okay. Chandler’s the one I’m mad at.,"Anger, Confusion, Frustration"
"Well, I’m still sorry. Is he here?","Neutral, Sadness"
In the box.,"Neutral, Nostalgia"
(going over to the box) Chandler?,"Neutral, Surprise, Confusion"
"Oh, he-he can’t talk right now.","Neutral, Confusion, Frustration"
Why not? What’s going on?,"Confusion, Frustration"
He’s just trying to show Joey how much he means to him.,"Happiness, Love, Optimism"
By being in a box?,"Neutral, Confusion, Frustration"
"Joey, had reasons.","Contentment, Neutral, Confusion"
They were threefold.,"Surprise, Anticipation, Confusion"
"Oh. Well uh, (to Chandler) you not being able to talk may makethis easier. Listen umm… (She looks at the gang who are watching, they take the hintand leave them alone.) Listen I don’t wanna be someone who comes between two bestfriends. I just, I can’t stand seeing what this is doing to you guys, and Idon’t wanna be the cause of that. So, I don’t think we can see each otheranymore. I’m gonna go to my mom’s in Chicago, I’m gonna stay there forawhile. I think this could’ve be something really amazing, but y’know this isprobably for the best. Y’know? I’m gonna miss you. Good-bye, Chandler.","Sadness, Confusion, Longing"
(starting to cry) Open the box!! (Runs over to do so.),"Sadness, Fear, Excitement"
What?!,"Surprise, Confusion, Frustration"
"He can still catch her! Come on, get out of there! (He opens the box) Getout of there!","Fear, Frustration"
So?,"Neutral, Confusion, Frustration"
"Yeah, we’re gonna be fine! Get out!","Confidence, Excitement, Optimism"
Yeah?,"Confidence, Neutral"
"Yeah, you did some real good thinkin’ in there.",Confidence
"Man, this is…","Excitement, Anticipation, Optimism"
Now go! ‘Cause you can still catch her! And Merry Christmas fromyou’re secret Santa! (Chandler runs out and closes the door.),"Surprise, Excitement, Anticipation"
"All right, who got Chandler? ‘Cause I uh, need to trade.","Confusion, Frustration, Longing"
"Oh, he sees her!","Happiness, Surprise, Excitement"
"Oh, he’s catching up to her!","Excitement, Anticipation, Optimism"
"Oh, she sees him! Oh, they’re hugging!","Happiness, Surprise, Excitement"
He’s taking her purse!,"Anger, Fear, Surprise"
"Uhh, that’s not them. I’m gonna go call the police.","Neutral, Fear, Confusion"
"Oh, there they are!","Happiness, Surprise, Excitement"
"All right, get a room.","Neutral, Disgust, Frustration"
