Dialogue,Emotions
"Okay, here we go! Emma's first birthday cake... Well hey... well, blow   out the candle. Come on Emma.","Happiness, Excitement, Anticipation"
"Let's do it, come on!","Confidence, Excitement, Anticipation"
What's wrong? Are you okay?,Unknown
"Oh yeah, nothing! These are happy tears! This is just what I wanted.","Happiness, Contentment, Excitement"
"(pointing at cake) Hey, you made it into a bunny.","Happiness, Surprise, Excitement"
What is wrong with me. It looked more delicious when it   was a penis.,"Disgust, Confusion, Frustration"
Okay.,Neutral
"Okay, you ready?","Confidence, Excitement, Anticipation"
Yeah.,Neutral
A-a-and... record.,"Confidence, Excitement, Anticipation"
"Okay. (they both look into the camera, and Ross waves.) Hi Emma. Well,   your first birthday is over, and it was really...","Happiness, Contentment, Love"
"(yelling at the top of her voice) Go, go, go Alan! Run you, hairy bastard!","Anger, Excitement, Frustration"
