Dialogue,Emotions
"What you guys don't understand is, for us,kissing is as important as any part of it.","Confidence, Love, Excitement"
"Yeah, right!.......Y'serious?",Surprise
"Oh, yeah!","Happiness, Excitement, Optimism"
Everything you need to know is in that first kiss.,"Love, Excitement, Anticipation"
Absolutely.,"Happiness, Contentment, Confidence"
"Yeah, I think for us, kissing is pretty much like an opening act,y'know? I mean it's like the stand-up comedian you have to sit through before Pink Floydcomes out.","Excitement, Anticipation, Optimism"
"Yeah, and-and it's not that we don't like the comedian, it's that-that...that's not why we bought the ticket.","Neutral, Confusion, Frustration"
"The problem is, though, after the concert's over, no matter how greatthe show was, you girls are always looking for the comedian again, y'know? I mean, we'rein the car, we're fighting traffic... basically just trying to stay awake.","Neutral, Frustration, Longing"
"Yeah, well, word of advice: Bring back the comedian. Otherwise next timeyou're gonna find yourself sitting at home, listening to that album alone.","Anger, Frustration"
(pause)....Are we still talking about sex?,"Surprise, Disgust, Confusion"
"No, it's good, it is good, it's just that- mm- doesn't she seem a littleangry?","Neutral, Confusion, Frustration"
"Well, she has issues.","Neutral, Sadness, Disgust"
Does she.,"Neutral, Confusion, Frustration"
"He's out banging other women over the head with a club, while she sitsat home trying to get the mastodon smell out of the carpet!","Anger, Disgust, Frustration"
"Marsha, these are cave people. Okay? They have issues like 'Gee, thatglacier's getting kinda close.' See?",Unknown
"Speaking of issues, isn't that your ex-wife?","Surprise, Disgust, Nostalgia"
(trying to ignore her) No. No.,"Neutral, Confusion, Frustration"
"Yes, it is. Carol! Hi!","Happiness, Surprise, Excitement"
"Okay, okay, yes, it is. (waves) How about I'll, uh, catch up with you inthe Ice Age.","Excitement, Anticipation"
Hi.,Neutral
So.,"Neutral, Confusion, Frustration"
"You look great. I, uh... I hate that.","Neutral, Sadness, Frustration"
Sorry. You look good too.,"Happiness, Contentment, Confidence"
"Ah, well, in here, anyone who... stands erect... So what's new? Still,uh...","Neutral, Confusion, Frustration"
A lesbian?,"Surprise, Disgust, Confusion"
"Well... you never know. How's, um.. how's the family?","Neutral, Nostalgia, Confusion"
"Marty's still totally paranoid. Oh, and, uh-",Frustration
"Why- why are you here, Carol?","Fear, Surprise, Confusion"
I'm pregnant.,"Happiness, Excitement, Anticipation"
Pregnant?!,"Fear, Surprise, Excitement"
"Oh, I think this is the episode of Three'sCompany where there's some kind of misunderstanding.","Excitement, Anticipation, Nostalgia"
...Then I've already seen this one! (Turns off the TV.),"Neutral, Confusion, Frustration"
(taking a drink from Joey) Are you through with that?,"Contentment, Confidence, Neutral"
"Yeah, sorry, the swallowing slowed me down.","Neutral, Frustration"
Whose little ball of paper is this?!,"Anger, Confusion, Frustration"
"Oh, uh, that would be mine. See, I wrote a note to myself, and then Irealised I didn't need it, so I balled it up and... (sees that Monica is glaring at him)...now I wish I was dead.",Fear
"She's already fluffed that pillow... Monica, you know, you've alreadyfluffed that- (Monica glares at her.) -but, it's fine!","Neutral, Anger, Frustration"
"Look , I'm sorry, guys, I just don't wanna give them any more ammunitionthan they already have.","Neutral, Fear, Frustration"
"Yes, and we all know how cruel a parent can be about the flatness of achild's pillow.","Neutral, Confusion, Frustration"
"Monica- Hi! Um, Monica, you're scaring me. I mean, you're like, you'relike all chaotic and twirly. And not-not in a good way.","Fear, Confusion, Frustration"
"Yeah, calm down. You don't see Ross getting all chaotic and twirly everytime they come.","Confidence, Neutral, Frustration"
"That's because as far as my parents are concerned, Ross can do no wrong.Y'see, he's the Prince. Apparently they had some big ceremony before I was born.","Neutral, Confusion, Frustration"
"(looking out the window) Ew, ew, ew, ew ew ew ew ew!","Fear, Disgust"
What?,"Surprise, Confusion, Frustration"
Ugly Naked Guy got a Thighmaster!,"Happiness, Surprise, Excitement"
Eeaagh!,"Fear, Surprise, Disgust"
Has anybody seen my engagement ring?,"Fear, Nostalgia, Frustration"
"Yeah, it's beautiful.","Happiness, Contentment, Love"
"Oh God, oh God, oh God oh God oh God oh God.... (Starts to look underthe couch cushions.)","Fear, Confusion, Frustration"
"No, look, don't touch that!","Fear, Frustration"
"Oh, like I wasn't dreading tomorrow enough, having to give it back tohim... 'Hi Barry! Remember me? I'm the girl in the veil who stomped on your heart in frontof your entire family!' Oh God and now I'm gonna have to return the ring, without thering, which makes it so much harder...","Sadness, Fear, Frustration"
"Easy Rach, we'll find it. (To all) Won't we!","Confidence, Excitement, Optimism"
Oh! Yeah!,"Happiness, Surprise, Excitement"
"Alright, when'd'ya have it on last?","Neutral, Confusion, Frustration"
Doy! Probably right before she lost it!,"Nostalgia, Confusion, Frustration"
You don't get a lot of 'doy' these days...,"Neutral, Nostalgia, Confusion"
"I know I had it this morning, and I know I had it when I was in thekitchen with...","Confidence, Confusion, Frustration"
...Dinah?,"Neutral, Surprise, Confusion"
"(looks at the lasagne and realizes something) Ohhhhh, don't be mad...","Fear, Surprise, Confusion"
You didn't.,"Neutral, Confusion, Frustration"
"Oh, I am sorry...",Sadness
I gave you one job! (Starts to examin the lasagne through the bottom ofthe glass pan.),"Anger, Disgust, Frustration"
"Oh, but look how straight those noodles are!","Happiness, Confidence, Excitement"
"Now, Monica, you know that's not how you look for an engagement ringin a lasagne...","Disgust, Confusion, Frustration"
(puts down the lasagne) I just... can't do it.,"Sadness, Confusion, Frustration"
Boys? We're going in.,"Confidence, Excitement, Anticipation"
(standing outside the door).....Hi.,"Confidence, Neutral, Excitement"
Wow. That is not a happy hi.,"Sadness, Surprise, Disgust"
Carol's pregnant.,"Happiness, Excitement, Anticipation"
(while everyone else is stunned) Ooh! I found it!,"Confidence, Surprise, Excitement"
W-w-wh-... wha-... w-w-w-...,"Fear, Confusion, Frustration"
"Yeah. Do that for another two hours, you might be where I am right aboutnow. (He enters.)","Confidence, Excitement, Frustration"
"Kinda puts that whole pillow thing in perspective, huh, Mon?","Contentment, Confusion, Frustration"
"Well now, how-how do you fit into this whole thing?","Anticipation, Confusion, Frustration"
"Well, Carol says she and Susan want me to be involved, but if I'm notcomfortable with it, I don't have to be involved.. basically it's entirely up to me.","Contentment, Confidence, Neutral"
She is so great! I miss her.,"Sadness, Love, Longing"
What does she mean by 'involved'?,"Surprise, Confusion, Frustration"
"I mean presumably, the biggest part of your job is done.","Contentment, Confidence, Optimism"
"Anyway, they want me to go down to this- sonogram thing with themtomorrow.","Neutral, Anticipation, Confusion"
So what are you gonna do?,"Neutral, Anticipation"
"I have no idea. No matter what I do, though, I'm still gonna be a father.","Confidence, Sadness, Frustration"
".....Well, this is still ruined, right?","Sadness, Disgust, Frustration"
"Oh, Martha Ludwin's daughter is gonna call you. (Tastes a snack)Mmm! What's that curry taste?","Happiness, Contentment, Excitement"
Curry.,Neutral
Mmmm!,"Happiness, Contentment, Excitement"
"I- I think they're great! I, I really do.","Happiness, Contentment, Confidence"
"(To Ross) Do you remember the Ludwins? The big one had a thing foryou, didn't she?","Surprise, Nostalgia"
They all had a thing for him.,"Love, Excitement, Anticipation"
"Aw, Mom...","Disgust, Frustration, Longing"
"I'm sorry, why is this girl going to call me?","Anticipation, Confusion, Frustration"
"Oh, she just graduated, and she wants to be something in cooking,or food, or.... I don't know. Anyway, I told her you had a restaurant-","Neutral, Anticipation, Confusion"
"No Mom, I don't have a restaurant, I work in a restaurant.","Confidence, Neutral, Frustration"
"Well, they don't have to know that... (She starts to fluff the samepillow Monica fluffed multiple times earlier.)",Confidence
"Ross, could you come and help me with the spaghetti, please?","Happiness, Contentment, Excitement"
Yeah. (They go to the kitchen.),"Confidence, Neutral, Excitement"
"Oh, we're having spaghetti! That's.... easy.","Happiness, Contentment, Confidence"
"I know this is going to sound unbelievably selfish, but, were youplanning on bringing up the whole baby/lesbian thing? Because I think it might take someof the heat off me.","Neutral, Confusion, Frustration"
"What that Rachel did to her life.... We ran into her parents at theclub, they were not playing very well.","Sadness, Surprise, Frustration"
I'm not gonna tell you what they spent on that wedding... but fortythousand dollars is a lot of money!,"Neutral, Surprise, Frustration"
"Well, at least she had the chance to leave a man at the altar...","Sadness, Anger, Disgust"
What's that supposed to mean?,"Disgust, Confusion, Frustration"
Nothing! It's an expression.,"Neutral, Confusion, Frustration"
No it's not.,"Neutral, Confusion, Frustration"
"Don't listen to your mother. You're independent, and you always havebeen! Even when you were a kid... and you were chubby, and you had no friends, you werejust fine! And you would read alone in your room, and your puzzles...","Contentment, Confidence, Nostalgia"
"Look, there are people like Ross whoneed to shoot for the stars, with his museum, and his papers getting published. Otherpeople are satisfied with staying where they are- I'm telling you, these are the peoplewho never get cancer.","Happiness, Contentment, Optimism"
"...And I read about these women trying to have it all, and I thankGod 'Our Little Harmonica' doesn't seem to have that problem.","Happiness, Contentment, Confidence"
"(trying desperately to change the subject) So, Ross, what's going onwith you? Any stories? (Digs her elbow into his hand.) No news, no little anecdotes toshare with the folks?","Neutral, Frustration"
"(pulls his hand away) Okay! Okay. (To his parents) Look, I, uh- I realiseyou guys have been wondering what exactly happened between Carol and me, and, so, well,here's the deal. Carol's a lesbian. She's living with a woman named Susan. She's pregnantwith my child, and she and Susan are going to raise the baby.","Sadness, Surprise, Confusion"
(To Monica) And you knew about this?!,"Anger, Surprise, Confusion"
"Your folks are really that bad, huh?","Neutral, Sadness"
"Well, y'know, these people are pros. They know what they're doing, theytake their time, they get the job done.","Contentment, Confidence, Optimism"
"Boy, I know they say you can't change your parents,... boy, if youcould- (To Ross) -I'd want yours.","Disgust, Frustration"
Must pee. (Goes to pee.),Neutral
"Y'know, it's even worse when you're twins.","Sadness, Confusion, Frustration"
You're twins?,Surprise
"Yeah. We don't speak. She's like this high-powered, driven career type.","Neutral, Disgust, Frustration"
What does she do?,"Neutral, Anticipation"
She's a waitress.,Neutral
"All right, you guys, I kinda gotta clean up now. (They all start toleave.)","Contentment, Neutral, Frustration"
"Chandler, you're an only child, right? You don't have any of this.","Neutral, Confusion, Frustration"
"Well, no, although I did have an imaginary friend, who... my parentsactually preferred.",Neutral
"The lights, please..",Neutral
...How long was I in there?,"Surprise, Confusion, Frustration"
I'm just cleaning up.,"Contentment, Confidence, Neutral"
D'ya.. uh.. d'ya need any help?,"Neutral, Confusion, Frustration"
"Uh.. okay, sure! Thanks! (She hands him the broom and sits down.)","Happiness, Contentment, Excitement"
"Anyway.. um.. (Starts to sweep.) So, you- uh- you nervous about Barrytomorrow?","Neutral, Anticipation, Confusion"
Oh.. a little..,"Contentment, Neutral, Nostalgia"
Mm-hmm..,"Contentment, Confidence, Neutral"
A lot.,"Neutral, Confusion, Frustration"
Mm.,Neutral
"So, got any advice? Y'know, as someone who's recently been- dumped?","Sadness, Frustration, Longing"
"Well, you may wanna steer clear of the word 'dumped'. Chances are he'sgonna be this, this broken shell of a man, y'know, so you should try not to look tooterrific, I know it'll be hard. Or, y'know, uh, hey!, I'll go down there, and I'll giveBarry back his ring, and you can go with Carol and Susan to the OB/GYN...","Sadness, Confusion, Frustration"
"Oh, you've got Carol tomorrow.. When did it get so complicated?","Confusion, Frustration, Longing"
Got me.,"Surprise, Confusion, Frustration"
Remember when we were in high school together?,"Happiness, Love, Nostalgia"
Yeah.,Neutral
"I mean, didn't you think you were just gonna meet somone, fall in love-and that'd be it? (Ross gazes at her.) ..Ross?","Sadness, Nostalgia, Longing"
"Yes, yes!","Happiness, Confidence, Excitement"
"Oh! Man, I never thought I'd be here.. (She leans back onto his hand.)","Happiness, Surprise, Excitement"
Me either... (He pulls up a stool so that he doesn't have to move hishand.),"Contentment, Neutral, Frustration"
"(entering) Sorry I'm late, I was stuck at work. There was this bigdinosaur.. thing.. anyway.",Frustration
Hi.,Neutral
"Ross, you remember Susan.","Happiness, Contentment, Nostalgia"
How could I forget?,"Surprise, Confusion, Frustration"
Ross.,"Neutral, Nostalgia, Confusion"
"(they shake hands) Hello, Susan. (To Carol) Good shake. Good shake. So,uh, we're just waiting for...?","Neutral, Anticipation, Confusion"
Dr. Oberman.,"Confidence, Neutral, Frustration"
..Dr. Oberman. Okay. And is he-,"Neutral, Confusion, Frustration"
She.,Neutral
"-she, of course, she- uh- familiar with our.. special situation?","Neutral, Confusion, Frustration"
"Yes, and she's very supportive.","Happiness, Contentment, Love"
"Okay, that's great. (Susan gives her drink to Carol.) No, I'm- Oh.","Surprise, Confusion, Frustration"
Thanks.,"Happiness, Contentment, Neutral"
"(picks up a surgical instrament and mimes a duck with it) Quack, quack..",Happiness
Ross? That opens my cervix. (He drops it in horror.),"Surprise, Disgust"
Barry?,"Surprise, Anticipation, Confusion"
C'mon in.,"Happiness, Contentment, Confidence"
(hesitates) Are you sure?,Confusion
"Yeah! It's fine, it's fine. Robbie's gonna be here for hours.","Happiness, Contentment, Excitement"
Huh?!,"Surprise, Confusion, Frustration"
"So, how ya doin?","Happiness, Contentment, Excitement"
I'm- uh- I'm okay... You look great!,"Contentment, Neutral, Surprise"
"Yeah, well..","Neutral, Confusion, Frustration"
"(over intercom) Dr. Farber, Jason Greenstein's gagging.","Fear, Disgust, Confusion"
(answering the intercom) Be right there. (To Robbie and Rachel) Be backin a sec.,"Neutral, Anticipation, Confusion"
I dumped him.,"Confidence, Anger, Frustration"
Okay.,Neutral
"So, um- so how's this, uh, how's this gonna work? Y'know, with us? Y'know,when, like, important decisions have to be made?","Confusion, Frustration"
Give me a 'for instance'.,"Confusion, Frustration, Optimism"
"Well, uh, uh, I don't know, okay, okay, how about with the, uh, with thebaby's name?","Confusion, Frustration"
Marlon-,"Neutral, Confusion, Frustration"
Marlon?!,"Surprise, Excitement, Anticipation"
"-if it's a boy, Minnie if it's a girl.","Love, Excitement, Anticipation"
...As in Mouse?,"Neutral, Surprise, Confusion"
As in my grandmother.,"Contentment, Love, Nostalgia"
"Still, you- you say Minnie, you hear Mouse. Um, how about, um.. how aboutJulia?","Anticipation, Confusion, Frustration"
Julia..,"Neutral, Surprise, Excitement"
We agreed on Minnie.,"Contentment, Confidence"
"'S'funny, um, uh, we agreed we'd spend the rest of our lives together.Things change, roll with the punches. I believe Julia's on the table..?","Sadness, Confusion, Frustration"
Sorry about that. So. What have you been up to?,"Neutral, Anticipation, Confusion"
"Oh, not much. I-I got a job.","Contentment, Confidence, Excitement"
"Oh, that's great.","Happiness, Contentment, Neutral"
Why are- why are you so tanned?,"Surprise, Confusion, Frustration"
"Oh, I, uh- I went to Aruba.","Confidence, Neutral, Anticipation"
Oh no. You went on our honeymoon alone?,"Sadness, Surprise, Frustration"
"No. I went with, uh.. Now, this may hurt.","Confidence, Fear, Frustration"
Me?!,"Surprise, Excitement, Confusion"
No! (To Rachel) I went with Mindy.,"Anger, Confusion, Frustration"
"Mindy?! My maid of honour, Mindy?!",Surprise
"Yeah, well, uh, we're kind of a thing now.","Confidence, Excitement, Nostalgia"
"Oh! Well, um.. (Grabs his forehand) You've got plugs!","Surprise, Disgust, Confusion"
Careful! They haven't quite taken yet.,"Neutral, Fear, Anticipation"
And you've got lenses! But you hate sticking your finger in your eye!,"Fear, Disgust, Frustration"
"Not for her. Listen, I really wanted to thank you.","Happiness, Contentment"
Okay..,"Neutral, Confusion, Frustration"
"See, about a month ago, I wanted to hurt you. More than I've ever wantedto hurt anyone in my life. And I'm an orthodontist.","Anger, Surprise, Frustration"
Wow.,"Surprise, Excitement, Nostalgia"
"You know, you were right? I mean, I thought we were happy. We weren'thappy. But with Mindy, now I'm happy. Spit.","Happiness, Sadness, Confusion"
What?,"Surprise, Confusion, Frustration"
Me. (Spits.),"Anger, Disgust, Frustration"
"Anyway, um, (Gets the ring out of her purse.) I guess this belongs toyou. And thank you for giving it to me.",Unknown
"Well, thank you for giving it back.",Contentment
Hello?!,"Surprise, Confusion, Frustration"
"Oh, please! What's wrong with Helen?","Confidence, Disgust, Frustration"
Helen Geller? I don't think so.,"Neutral, Disgust, Confusion"
Hello? It's not gonna be Helen Geller.,"Neutral, Confusion, Frustration"
Thank you!,"Happiness, Contentment"
"No, I mean it's not Geller.","Neutral, Confusion, Frustration"
"What, it's gonna be Helen Willick?","Surprise, Confusion, Frustration"
"No, actually, um, we talked about Helen Willick-Bunch.","Neutral, Confusion, Frustration"
"Well, wait a minute, wha- why is she in the title?","Surprise, Confusion, Frustration"
It's my baby too.,"Confidence, Love, Frustration"
"Oh, 's'funny, really? Um, I don't remember you making any sperm.",Confusion
"Yeah, and we all know what a challenge that is!","Disgust, Frustration"
"All right, you two, stop it!","Anger, Confusion, Frustration"
"No no no, she gets a credit, hey, I'm in there too.","Confidence, Frustration, Longing"
Ross. You're not actually suggesting Helen Willick-Bunch-Geller? 'Cause Ithink that borders on child abuse.,"Surprise, Disgust, Frustration"
"Of course not, I'm... suggesting Geller-Willick-Bunch.","Confidence, Excitement, Optimism"
"Oh, no, nonononono, you see what he's doing? He knows no-one's gonna sayall those names, so they'll wind up calling her Geller, then he gets his way!","Sadness, Anger, Frustration"
"My way?! You-you think this is my way? Believe me, of all the ways I everimagined this moment in my life being, this is not my way- y'know what? Uh, um, this istoo hard. I'm not, I can't do-","Sadness, Confusion, Frustration"
(entering) Knock knock!How are we today? Any nausea?,"Happiness, Confidence, Neutral"
Yeah. Yeah. A little.,"Contentment, Neutral, Nostalgia"
"Well, I was just wondering about the mother-to-be, but.. thanks forsharing. (To Carol) Uh, lie back..","Neutral, Confusion, Frustration"
"You- uh- y'know what, I'm gonna go. I don't- I don't think I can beinvolved in this particular thing right now.","Neutral, Confusion, Frustration"
Oh my God.,"Fear, Surprise, Excitement"
Look at that.,"Surprise, Excitement"
I know.,"Confidence, Neutral"
Well? Isn't that amazing?,"Surprise, Excitement"
What are we supposed to be seeing here?,"Confusion, Frustration, Optimism"
"I dunno, but.. I think it's about to attack the Enterprise.","Fear, Anticipation, Confusion"
"You know, if you tilt your head to the left, and relax your eyes, itkinda looks like an old potato.","Contentment, Surprise, Excitement"
"Then don't do that, alright?","Confidence, Neutral, Frustration"
Okay!,"Happiness, Confidence, Excitement"
(walks over to where Monica is standing)Monica. Whaddya think?,"Confidence, Excitement, Anticipation"
(welling up) Mm-hmm.,"Happiness, Contentment, Neutral"
Wh- are you welling up?,"Sadness, Confusion"
No.,"Neutral, Disgust, Frustration"
"You are, you're welling up.","Sadness, Surprise, Nostalgia"
Am not!,"Anger, Frustration"
You're gonna be an aunt.,"Happiness, Love, Excitement"
(pushes him and starts to cry) Oh shut up!,"Sadness, Anger, Frustration"
"(on phone) Hi, Mindy. Hi, it-it's Rachel. Yeah, I'm fine. I-I saw Barrytoday. Oh, yeah, yeah he-he told me. No, no, it's okay. I hope you two are very happy, Ireally do. Oh, oh, and Mind, y'know, if-if everything works out, and you guys end upgetting married and having kids- and everything- I just hope they have his old hairlineand your old nose. (Slams the phone down.) (To everyone) Okay, I know it was a cheap shot,but I feel","Sadness, Anger, Frustration"
