Dialogue,Emotions
"Oh, great! Listen, oh I had to get you a whole new battery. I got you thebest one I could, ‘cause that’s not where you want to skimp.","Happiness, Contentment, Optimism"
"You’re a genius, Ross.","Happiness, Confidence, Excitement"
"Yeah, well it came to about $112, but what the hell, just call it an even110?","Contentment, Frustration, Optimism"
"Okay, I’ll pay you tomorrow. (pushes him out the door)","Confidence, Disgust, Frustration"
Okay.,"Contentment, Confidence, Neutral"
"Okay, bye!!","Happiness, Confidence, Excitement"
"So they ah, they all took off, it was pretty hard watching them go,y'know?","Sadness, Nostalgia, Longing"
"Yeah, okay, bye. (closes the door, turns out the lights, and runs back tothe bedroom)","Neutral, Confusion, Frustration"
(outside the door) So I’m gonna take off then!,"Confidence, Excitement, Anticipation"
